{
  "documentVersion": 1,
  "cohorteVersion": "3.0.0-dev",
  "generatedAt": "2026-09-18T10:00:42.250Z",
  "ok": false,
  "checks": [
    {
      "id": "node",
      "status": "ok",
      "summary": "Node 24.21.0"
    },
    {
      "id": "search-backend",
      "status": "warning",
      "summary": "ripgrep not found: search uses git grep",
      "detail": "no rg binary on PATH",
      "remediation": "Install ripgrep."
    },
    {
      "id": "sandbox-linux",
      "status": "skipped",
      "summary": "not a Linux host"
    }
  ],
  "sandbox": {
    "platform": "darwin",
    "backend": "seatbelt",
    "filesystem": "enforced",
    "network": "enforced-off",
    "probes": [
      {
        "id": "S-28",
        "passed": true
      }
    ]
  },
  "runtimeCapabilities": {
    "contractVersion": "1",
    "streaming": true,
    "pause": ["tool-boundary", "model-boundary"],
    "steering": false
  }
}
